-,키워드,PC 검색량,모바일 검색량,총조회수,문서수,비율,블로그순위 ▼,,,,,,,,,,,,,,
-,쥬시쿨,720,"3,490","4,210","34,446",8.182,- (-),"N떡참 네고왕 로제 쌀떡볶이  치킨 쥬시쿨 광주 봉선점2022-04-08떡참 네고왕 세트는 떡볶이 + 치킨 + 쥬시쿨 + 치즈볼 로 구성되어 있어요! 금액은 9,800원 떡참... 맵기1단계로 쥬시쿨 마실 생각이 1도 없었고 떡볶이랑 치킨 다 먹은 후 마무리로 쥬시쿨 마셨어요! 떡참... 나를 완성하는 하루하루https://blog.naver.com/0102sumin?Redirect=Log&logNo=222694761856N신당동마복림할머니즉석떡볶이쥬시쿨맛집2021-12-20옆 테이블에서 쥬시쿨 맛집이네 이랬는데 .. 눈앞에 있는 즉석떡볶이의 기대감에 부풀어서 .. 무슨 소리... 옆테이블에서 왜 쥬시쿨맛집이라고 한지 .. 공감이되었네요 정말정말 개인적으로 솔직한 남친돈남친산... 인천공장Bank~♬https://blog.naver.com/572_5888?Redirect=Log&logNo=222599928619N빙그레, 쥬시쿨, 요구르트 등 일부 유제품 가격 인상2022-04-13빙그레가 쥬시쿨, 요구르트 등 일부 유제품의 가격을 올리기로 했다. 이번 가격 인상 품목은 작년 유제품 가격 인상에 반영되지 않은 품목이다. 가격 인상 내용은 출고가격 기준으로 쥬시쿨 6.7... 세상 모든 이야기···경제, 맛집, 여행, 자동차https://blog.naver.com/yes1676?Redirect=Log&logNo=222699405072N[평일 일상] 녹차쉐이크/카야토스트/산타놀이/찜닭/쥬시쿨... 2022-02-08먹느라 이것밖에 못 찍었..ㅋ 저녁은 찜닭 시켜서 야무지게 잘 먹음b 먼 길 와줘서 너무너무너무 고마어♡ 2/8(화) 가래떡 굽굽 예랑이 아침 가래떡구이 & 커피 새벽배송은 너무 설레지 쥬시쿨/쿨피스 왜... ♣일상의 소중함♣https://blog.naver.com/jtu0323?Redirect=Log&logNo=222642123512N빙그레 쥬시쿨 자두 상큼해2021-05-14빙그레 쥬시쿨 자듀 상큼해 점심때 불닭발 먹고 너무 매워서 편의점에 가서 음료를 찾던중에 달달하고... 음식을 먹고 마시면 딱 좋을것 같아요~ 지금까지 가격도 착하고 맛난 빙그레 쥬시쿨 먹어본 후기 였습니다.장지원 한복https://blog.naver.com/dlsehtnvdldi?Redirect=Log&logNo=222351115231N빙그레 쥬시쿨 사과에이드와 금귤&감귤에이드2021-11-07주말 아침 따뜻한 날씨가 좋아서 오랜만에 산책을 하고 돌아오는 길에 편의점에서 맛있는 음료를 사왔어요~ 저에게 주는 작은 보상 같은(?) 빙그레 쥬시쿨 에이드를 소개합니다 :-) 빙그레 쥬시쿨 에이드 원래는... GOLD DAYhttps://blog.naver.com/heqkfkaxcv_0?Redirect=Log&logNo=222561186137N이디야 갤럭시치노 오로라 & 샤인파인 수박바 쥬시쿨 생각난다!2021-07-15이것도 역시나 마시면서 익숙한 맛이네~ 하다보면 완전 쥬시쿨 맛이에요. 그래도 상콤달콤 맛 조화가 나쁘지 않아서 이건 막 비추는 아니에요~ ㅋㅋ 둘 다 마시고나면 시원한 불량식품을 잔뜩 먹은 느낌이 입안에... 낭랑주부's “똑”소리나는 살림이야기https://blog.naver.com/jasmin7141?Redirect=Log&logNo=222432352100N쥬시쿨 청포도 에이드 과채음료 맑고 투명한 상콤한 맛보셨나요?!2022-01-10빙그레 쥬시쿨 한번쯤 맛보신 유산균 음료부터 감귤 에이드 까지 다양한 스타일의 맛과 향기로 쿨피스와 양대산맥으로 불릴만큼 쥬시쿨이 향긋 상큼한 맛으로 청포도 에이드로도 나왔나봐요!! 늘 먹던 유산균... 느낌으로 아는힘 컨슈니어 시각으로 본다""https://blog.naver.com/nomad5893?Redirect=Log&logNo=222618014906N초딩으로 돌아가기(feat. 얼린 쥬시쿨)2022-03-31얼려서 몸뚱이 저거 허얘진거 보이지 쥬시쿨이 집에 있는데 그냥 먹기는 아쉽잖아",," 아주 잘 얼었어 내 무기는 포크 아이스크림 막대가 아니어서 쫌 아쉽지만 ㅠ 근데 이거 너무 꽝꽝 얼어서.... 쥐똥만큼... @seolhyeon._https://blog.naver.com/yshyeon22?Redirect=Log&logNo=222687782207N빙그레 쥬시쿨 사과에이드2021-09-12과일맛유산균음료로 알려진 쥬시쿨에서도 이런 상품이 나온다. 제조는 늘 언급하곤 하는... 느낌이 있었는데 그게 포멜로였나보다. 재구매를 생각할만한 음료라고 본다. 빙그레 쥬시쿨 사과에이드 250mlx10컵피란제아의 잡다구리https://blog.naver.com/fillanzea?Redirect=Log&logNo=222503094132""",,,,,,,,,,,
-,서울우유,"8,100","30,200","38,300","182,484",4.765,- (-),"N서울우유 검은콩 블랙라벨 세븐일레븐 4월행사 2+12022-04-01여튼 서울우유 검은콩우유는 신상품이라 쓰여있었지만, 검색해보면 다른 디자인으로도 나오는 것이, 단종되었다가 새로 나온건가? 싶더라구요. 디자인은 이번이 나은 듯~ 국산 검은콩(약콩) 농축액 0.185... -에르르네 집。https://blog.naver.com/aeirmeki?Redirect=Log&logNo=222689073844N서울우유 더 진한 플레인요거트 순수로 집에서 그릭요거트... 2022-04-12나는 서울우유 순수 더진한 플레인요거트를 사용했다 . 우유를 사서 플레인요거트부터 만드는 방법도 있지만 넘 귀찮고 시간도 많이 들어서 그냥 요거트는 돈 주고 샀음... http://naver.me/xhA6py2W 대형마트에 가면... YOUNG FOREVERhttps://blog.naver.com/gde0817?Redirect=Log&logNo=222698746861N서울우유 대용량요거트 더진한플레인요거트 순수1.8L2022-02-20서울우유 대용량요거트 더진한플레인요거트 순수1.8L 여러분 안녕하세요 루나입니다! 요즘 제가 다시금... 브랜드인 서울우유에서 나온 더진한 플레인요거트 순수를 후다닥 알아봤습니다 ㅋㅋㅋㅋ 설탕이... 루나의 다락방https://blog.naver.com/hanabi_02?Redirect=Log&logNo=222652971238N밀크티잼, 얼그레이잼 만들기  w 서울우유2022-01-05서울우유로 밀크티잼 만들기 예전에 찍은 사진이라 유통기한이 지나있어요 서울우유 그린라벨 우유를 이용해서 밀크티잼을 만들었어요. 서울우유 그린라벨은 HACCP인증을 받은 목장에서 엄선하고, 체세포수... 정이월드https://blog.naver.com/song871?Redirect=Log&logNo=222613681255N용인 플랫폼시티 정리 + 구성역 서울우유부지 신축아파트... 2022-02-042) 노선도 : 파주(운정) - 킨텍스(일산) - 대곡 - 연신내 - 서울역 - 삼성역 - 수서역 - 이매역(성남)... 용인 플랫폼시티 구성역 서울우유 부지에 신축아파트가 후분양된다! e편한세상 구성(가칭) 으로 999세대를... 직딩 혜무늘보 돈버는 일상https://blog.naver.com/mellongi123?Redirect=Log&logNo=222638540332N수제 그릭요거트 만들기/서울우유요거트로 그릭요거트 만들기2022-04-05- 준비물 : 서울우유 더 진한 플레인 요거트, 면포, 무거운 물건(??), 1. 요거트를 준비한다. 일단 이... 어떤사람은 우유>요거트>그릭요거트 로 전체다 수제로 만들지만, 그거까지 하면 난 안해먹을것을 알기에... 여기서 행복하기https://blog.naver.com/c1c2c3c4c?Redirect=Log&logNo=222692094518N[서울우유 메이플진저잣 두유] 엄마 이게 뭐야 두유에서 생강... 2022-03-11그 이후 아 서울우유가 우유말고 잘하는 것들이 많구나, 무한 신뢰를 가지게 되었는데 (위의 흑임자우유와 고단백저지방 우유는 아직 온고잉 중이니 강추한다.. 꾸덕한 흑임자우유와 식단 중일 때 물같지 않은... mellow minglehttps://blog.naver.com/ohnyoou?Redirect=Log&logNo=222669887165N[단백질 음료 추천]서울우유 에서 만든 클릭유 화이트프로틴 후기2022-02-20서울우유 클릭유 화이트프로틴은 우유회사에서 만든 단백질 음료인만큼 우유단백질 100%를 사용했어요. 단백질의 종류가 여러가지인데 우유 단백질은 유청단백질과 카제인단백질로 이루어져 있어요. 이... 샨잉샨잉의 블로그https://blog.naver.com/sunjoy0902?Redirect=Log&logNo=222652502043N아이들 간식으로 좋은 서울우유 유기농주스2022-03-22그런데 믿고 마시는 서울우유에서 어린이주스가 출시되어 마셔봤는데 정말 맛있어서 어린이간식으로 추천하고 싶더라구요~! 서울우유 유기농주스에요. 이 어린이주스가 좋은 가장 큰 이유는 채소를 잘 먹지... 라후네와글와글+꽈리https://blog.naver.com/redhollyhock?Redirect=Log&logNo=222680064050N간식으로 챙기는 서울우유 그린라벨은 도대체 어떤 우유일까?2022-03-23아침에는 시리얼과 함께 섭취를 하고, 음료 대신 수시로 흰 우유를 마신다. 서울우유 그린라벨은 좀 더 진하고 고소한 맛이 있다. 아주 미묘한 차이지만, 우유를 많이 먹는 아이들은 그 차이를 아는 것 같다.... 코끼리공장의 해피엔드https://blog.naver.com/2005_01_08?Redirect=Log&logNo=222680348460",,,,,,,,,,,,,
-,맑은샘물,180,860,"1,040","71,330",68.587,높음 (15),"N지구를 생각하는 스마트 컨슈머와 무라벨 생수[맑은 샘물]... 2021-05-05홈플러스 시그니처 무라벨 맑은 샘물은 환경을 위해 라벨을 없애 이산화탄소 배출양 감소에 도움을... 일주일에 10병의 생수를 시그니처 무라벨 맑은 샘물로 바꾼다면 일년에 약 400g의 플라스틱을 아낄 수... 당당줌마의 바느질세상https://blog.naver.com/empal69?Redirect=Log&logNo=222339348290N분리수거가 쉬운 무라벨생수 홈플러스 시그니처 맑은샘물2021-05-06홈플러스 시그니처 상품 소개해요~ 바로바로~ 홈플러스 시그니처 맑은샘물 이에요~ 환경을 사랑하는... 한쪽에는 제품명 홈플러스 시그니처 맑은샘물이 적혀있고요. 반대편에는 제조일과 수원지 정보가 있네요.... 추억남기기https://blog.naver.com/july_first?Redirect=Log&logNo=222340015221N동원샘물 생수 , 새롭게... 디자인과 환경을 생각하는 맑은 샘물2022-04-12동원 샘물 2L 맑은 샘물 입니다~ 물의 성분은 심층암반수 그대로이고 제품의 디자인의 변화가... 같아요~ 맑은 물답게 깔끔하게 넘어가는 동원샘물이에요~ 자주 마셔주고 있습니다 ㅎㅎ - 추가로 4월 10일부터... HYEON lifehttps://blog.naver.com/shhs7?Redirect=Log&logNo=222699038126N에비앙 fiji 물 맑은샘물 생수차이점 피지워터 헛개수물 헛개차2021-07-26♥ 오늘은 #에비앙 #fiji #물 #맑은샘물 #생수차이점 #피지워터 #헛개수물 #헛개차 에 대해서 직접... 대상은 헛개수물과 맑은샘물 그리고 에비앙과 피지워터였습니다. 피지워터는 흔히 '오렌지박스' 라고 하는... ♥신나게, 상콤하게, 자신있게♥https://blog.naver.com/seoyunk94?Redirect=Log&logNo=222445510567N계유일주는 맑은 샘물이다 / 편인 / 병 / 갑목일간 / 을목일간... 2021-11-14계유일주는 맑은 샘물이다. 癸酉 계유일주의 물상은 ‘옹달샘’과 같다. 유금이라는 금은 천간으로... 깨끗하고 잘 다듬어진 돌에 계수라는 ‘음수’가 모여 있으므로 백웅도사는 계유일주를 ‘맑은 샘물’... 백웅도사 운명연구소｜사주 타로https://blog.naver.com/whitebear_dosa?Redirect=Log&logNo=222567820399N전통주양조장 맑은 샘물처럼 깔끔한 맛 녹천주조장 한산소곡주2021-03-27건지산의 맑은 물과 정성, 현대적인 깔끔한 설비로 위생적으로 만들어지는 녹천 주조장 모든 과정을 거쳐 완성된 소곡주는 소비자를 기다리고 있었습니다 정성으로 만들어진 녹 맑은 샘물처럼 깔끔한 맛... 1500년을 이어져 내려져 온 술, 서천한산소곡주https://blog.naver.com/wjd3064?Redirect=Log&logNo=222288408965N동원샘물 라벨프리 맑은 샘물 마셔요2022-03-23지친 일상에 활력이 되어줄 생수를 찾는 분들, 추천드려요! #동원샘물, #무라벨생수, #무라밸생수, #라벨프리생수, #친환경생수, #동원샘물무라벨, #동원샘물라벨프리, #생수추천, #맑은샘물, #동원샘물생수Welcome *https://blog.naver.com/soul7434?Redirect=Log&logNo=222680511915N홈플러스 시그니처 맑은샘물, 무라벨 생수2021-05-10시그니처 맑은 샘물, 무라벨 생수 홈플러스시그니처 시그니처 무라벨 생수는 경기산청분 지리산... ㅋㅋ 20개 묶음을 위한 비닐말고는 없는 무라벨 맑은 샘물 군더더기 없는 깔끔한 맛으로 아침에 한병씩!! 하루... 일상의 감상https://blog.naver.com/eakyonj1004?Redirect=Log&logNo=222344408413N홈플러스 시그니처 :: 무라벨 맑은샘물 :: 지구를 생각하는... 2021-05-07ㅋㅋㅋㅋ 근데 홈플에서 이번에 #무라벨 맑은 샘물을 출시했어요!! 아 착한사람들!! #무라벨생수 라니요 칭찬합니다.!! 감사합니다.!! 경기 연천군 백학면 / 경기 산청군 지리산 일대의 수원지에서 생산되는 청정... YOJOCOOK 요리조리 맛깔나는인생https://blog.naver.com/kyh618?Redirect=Log&logNo=222341920704N동원샘물 친환경 맑은 샘물 무라벨 생수2022-02-21라벨이 덕지덕지 붙어 있는 것보다 깔끔하고 맑은 샘물이 눈에 더 잘 들어옵니다. 믿을 수 있는 동원샘물!!! 물에도 맛이 있다고 생각해요. 제가 꾸준히 친환경 생수들을 많이 마셔봤는데 그 중에서 제 입에 맞는... 아이키우기 대작전https://blog.naver.com/ekdqjseowkd?Redirect=Log&logNo=222653287207",,,,,,,,,,,,,
-,카페25,480,"1,250","1,730","8,340",4.821,- (-),"N일상-만보기 앱테크와 지에스25(공짜 카페25), 주저리주저리2022-01-13GS25 카페 25 가격 및 에스프레소 머신 사용 방법 솔직히 쉬미는 사용방법 안 읽어 보고... 그냥 왼쪽 맨 위에 있는 핫 아메리카노 버튼을 클릭하고... 대충... 컵은 여기 놓으면 되겠지~하고 출수구 2개가 있는... 쉬미's 사적인 공간https://blog.naver.com/smijoung?Redirect=Log&logNo=222620509280N슬기로운의사생활 스윗한 정원샘 유연석이 마시는 카페252020-04-02슬기로운의사생활 캡처 그런데 이렇게 잘생긴 유연석이 이번엔 제주도에서 카페를 하던 경력을 살려 2020년 GS25 원두커피브랜드 카페25의 메인 모델이 되었대요. 짝짝짝!! 유연석 씨 이미지랑 커피랑 너무 잘... 따스한 햇살 그리고 가벼운 발걸음https://blog.naver.com/zamtangei?Redirect=Log&logNo=221887014169N카페25, 유튜브, ‘베르테르’ 라이브 방송 영상 & 막공... 2020-10-07길에 카페25 멤버십 페이백 포인트를 사용하기 위해 gs25 편의점에 들렀다! 8월 기준, 100% 페이백 이벤트를 했어서 2500원의 포인트 전액을 사용해서 핫 아메리카노(1200원), 핫 카페라떼(1700원)를 구매했다. 지금... 로에’s Diary??https://blog.naver.com/taeback5?Redirect=Log&logNo=222109551529N카페25, 급이 다른 편의점커피, GS25신상 에스프레소를 1... 2022-04-05그렇다고해서 인스턴트나 편의점커피로는 채워지지 않는 카페인에 울며 겨자먹기로 사먹곤 하였습니다. 최근 우연히 간 GS25에서 만난 편의점신상 카페25에스프레소는 제가 가지고 있던 편의점커피에 대한... 호텔 그리고 여행https://blog.naver.com/hote1tour?Redirect=Log&logNo=222692653117NGS25 카페25 모카라떼 마셔봤어요2021-12-31GS25 카페25는 최고급커피머신, 스페셜티블렌딩원두, 친환경 컵을 사용한 커피네요. 저는 GS25 커피는 이번에 처음 마셔봤어요. 남자친구는 아메리카노를 마셔봤는데 맛이 괜찮았다고 하더라고요. 카페25... 플러키비비의 맛있는 이야기♡https://blog.naver.com/loveyou12?Redirect=Log&logNo=222609802910N더팝플러스 카페 25 구매후기-실전편2022-03-14함께 읽으면 좋은 글 더팝플러스 이용하기 더팝 한끼플러스 #더팝플러스 #더팝플러스카페25 #GS25커피 #가성비좋은커피 #저렴한커피 #GS25행사 #알뜰생활 #절약생활 #지출방어매일매일 수익내기https://blog.naver.com/thdudskdwk?Redirect=Log&logNo=222672115800NGS25 커피 카페25 신상 아이스 리얼 바닐라라떼 추천, 할인팁2021-06-27- 있기는 하지만, 정말로 매우, 매우 작은지라 ㅋㅋㅋ 이런 고급 카페 메뉴를 소화하기엔 아직 무리거든요  카페에서 먹는 것 같은 달달한 바닐라라떼는 앞으로도 당분간 GS25 카페25 커피를 이용하는 걸로! 그럼... 백곰의 빼꼼 내다보기https://blog.naver.com/polar2795?Redirect=Log&logNo=222412001116N카페25 갓성비 에스프레소 1,000원으로 즐기기2022-04-06카페25에스프레소 편의점커피 안녕하십니까 사장님덜 쭌사장 입니다 오늘은 GS25카페의 편의점커피 카페25에스프레소 를 소개해드릴려고 하는데요 GS25카페를 자주 이용하고 있는 저의 입장에서 말씀을... 쭌사장의 우쭐한 사생활https://blog.naver.com/championjun?Redirect=Log&logNo=222692983379N편의점 커피 추천 - 유연석 카페25 가격,맛2020-05-25이거 보고 나서 커피도 유연석 카페25것만 먹어요 집 근처에 솔직히 GS25편의점이 제일 많기도 하고... 않은데 카페라떼도 1,700원이구... 흑당커피나 오렌지블론드 같은 종류도 있구요 요즘 여름이니까 아이스... 케넨의 하루https://blog.naver.com/teemogogo?Redirect=Log&logNo=221977297452N더팝플러스 카페25 사용후기2022-04-11GS25에서 카페25 구독서비스 구매후 받아서 이용중입니다. 제가 일하는 곳 바로 옆 편의점이라서 커피 생각나면 일주일에 3~4번은 들러서 마셔요. 아이스아메리카노가 1700원이면 비싸다고 느껴졌어요.... 브레인khttps://blog.naver.com/jewel9836?Redirect=Log&logNo=222698085100",,,,,,,,,,,,,
-,생귤탱귤감귤,20,250,270,"1,218",4.511,높음 (3),"N[빙그레] 생귤탱귤감귤2021-10-19#빙그레 #귤맛 #생귤탱귤감귤 #아이스크림 오늘의 아이스크림은 생귤탱귤 감귤. 겨울은 아무래도... 전반적으로 감귤의 새콤한 맛이 느껴지긴 하지만 신맛보단 단맛이 더 와닿는다. 베라의 레인보우샤베트처럼... 되는대로 살자 :)https://blog.naver.com/eungi96?Redirect=Log&logNo=222542066935N생귤탱귤 감귤, 저칼로리 아이스크림, 다이어트 할 때 먹는... 2020-08-12이미 썸네일에 나와있는 생귤탱귤 감귤입니다. 제주산 감귤 50%가 함유된 아이스크림이죠~? 친구는 오렌지 주스 얼린 맛이라고 하는데, 따지고보면 더위사냥도 커피 얼린 맛이랑 비슷하죠 ㅋㅋ 요즘... 마음을 담는 글쟁이https://blog.naver.com/sssch330?Redirect=Log&logNo=222058157624N상큼시원한 아이스크림 생귤탱귤 감귤 VS 엔초민트2021-12-03딱인 생귤탱귤 감귤 아이스크림인데요. 보기에는 비타민C 팍팍 들어간 색감이라 새콤만 할 것 같은데... 같아요 #상큼한아이스크림 #생귤탱귤 #감귤아이스크림 #민트아이스크림 #민초단 #엔초 #엔초민트... 빛나는 하루의 정리https://blog.naver.com/eblovebr0915?Redirect=Log&logNo=222586208068N빙그레  생귤탱귤 감귤 - 제주산 상큼한 과일 아이스!2021-07-05이름도 구수하게 잘 지었네요, 생귤탱귤 감귤! 빙과 70ml, 감귤농축과즘 7.5%, 제주산 감귤 50%가 함유되어 있습니다. 해태 용암수 아이스바도 제주 용암수로 만들어졌는데 요즘 제주도에서 만들어진 식자재들이... 神出鬼沒https://blog.naver.com/sinchulgwimol?Redirect=Log&logNo=222421410321N생탱감귤(생귤탱귤감귤)VS천혜향 아이스크림 비교2022-03-18#생탱감귤 #천혜향 #생귤탱귤감귤 #아이스크림 #아이스 #아이스크림비교 오늘은 제가 이 두개의 아이스크림을 리뷰해보려고 해요! 저는 아이스크림중에 살짝 얼음으로 된 아이스크림을 좋아하는데 폴라포... 헬로 논싼https://blog.naver.com/konal2001?Redirect=Log&logNo=222676151799N해태부라보바초코청크마일드,빙그레생귤탱귤감귤후기(가격... 2020-07-04여름엔 막대바, 하드를 먹어줘야 하잖아요.^^ 해태 부라보바 초코청크마일드와 빙그레 생귤탱귤감귤... 감귤농축과즙, 감귤자몽시럽등이 보이네요.^^ 우유베이스가 아니라서 역시나 딱딱했어요. 좀 녹인... 초코송이 플레이스https://blog.naver.com/dotororo99?Redirect=Log&logNo=222020641120N아이스크림 리뷰 - 빙그레 '생귤탱귤 감귤'2021-07-24생귤탱귤감귤이다 일단 이건 내가 옛날부터 엄청 좋아했다 상큼달달 딱 내입맛ㅎㅎ 맛은 감귤 맛이... 빙그레 #생귤탱귤 #생귤탱귤감귤 #빙그레생귤탱귤감귤 #생귤탱귤감귤리뷰 #후식 #후식추천 #디저트... imstar bloghttps://blog.naver.com/imstar0709?Redirect=Log&logNo=222443603517N생귤탱귤감귤 아이스크림 리뷰2021-09-10#생귤탱귤감귤 #생귤탱귤감귤리뷰 #생귤탱귤 #생귤 #탱귤 #감귤#내돈내산 #내돈내먹 #감귤아이스크림 #감귤맛 #감귤맛아이스크림추천 #막대아이스크림 #아이스크림리뷰 #아이스크림추천 #아이스크림후기 #간식... 누군가의 이야기?https://blog.naver.com/hewon430?Redirect=Log&logNo=222501822345N가공식품에서 이물질 나왔을 때 대처법 (빙그레 생귤탱귤감귤에... 2020-08-02글을 가져왔어욤 ∩^ω^∩ 제가 생귤탱귤감귤 아이스크림을 너무너무너무 좋아하는데 먹다가 글쎄... 솔직히 기분이 상하긴 했는데 담당자분께서 너무 죄송하다고 친절하게 이야기해주셨고, 생귤탱귤감귤... 디듀의 일기장https://blog.naver.com/hjisu323?Redirect=Log&logNo=222049282330N빙그레 생귤탱귤 감귤 아이스크림 리뷰2021-08-01첫인상은 감귤쥬스 얼린 느낌이에요 향도 감귤향 물씬물씬~~ 시원한 감귤 샤베트 아이스크림바 입니다. 그냥 생각대로의 맛이에요~~ 감귤 좋아하신다면 빙그레 생귤탱귤 감귤 아이스크림 추천드립니다~^^행복한 사람이 되고 싶은 블로거https://blog.naver.com/fortrees99?Redirect=Log&logNo=222453513941",,,,,,,,,,,,,
