-,키워드,PC 검색량,모바일 검색량,총조회수,문서수,비율,블로그순위 ▼,,,,,,,,,,,,,,
-,비틀즈,"5,420","27,300","32,720","221,923",6.782,낮음 (0),"N(영국 리버풀 / 리버풀 도보 여행 #7) 비틀즈가 탄생한 영국 대표... 2022-04-11이렇게 공연을 사랑하는 리버풀 사람들이 있기에, 비틀즈라는 세계적인 밴드가 탄생할 수 있었을 거예요. 비틀즈 얘기가 나온 김에 다음 시간에는 비틀즈가 탄생한 그 거리로 가보도록 하겠습니다. 촬영일... 오렌지군의 행복을 찾아서..https://blog.naver.com/dickprod?Redirect=Log&logNo=222656311997N우쿨렐레 악보 : I Will - 비틀즈2022-03-03비틀즈(The Beatles)의 <I Will> 대중음악 역사상 최고의 밴드, 비틀즈(The Beatles) #빌보드1위_무려20곡 #최고의_싱어송라이터 1960년 영국 리버풀(Liverpool)에서 결성된 비틀즈는 활동 기간이 겨우 7~8년 정도... 음악 온라인 클래스 No.1 도약닷컴https://blog.naver.com/doyaccom?Redirect=Log&logNo=222662613257N비틀즈라고?2022-02-13갈수록 ‘비틀즈’라는 표기가 껄끄러워진다. 왜 사람들은, 특히 오랫동안 이 위대한 밴드를 좋아해 온 이들은 옳은 표기이자 발음인 ‘비틀스’로 쓰기를 꺼릴까? 이유가 있을 것이다. 예전부터 비틀즈... Interstellar Overdrivehttps://blog.naver.com/abdabs?Redirect=Log&logNo=222646365659N[팝에피소드] 비틀즈 사과로고를 베낀 잡스의 애플, 롤링스톤스... 2022-03-16한편 비틀즈는 캐피탈레코드, VJ레코드, EMI레코드 등 여러 레코드사와 계약을 맺고 있다가 자신들의 유명세를 위해 단일 창구가 필요했다. 1968년 비틀즈 멤버는 매니저 브라이언 엡스타인과 독자적인 음반사... 선성원(huskysun)님의 대중문화 블로그https://blog.naver.com/sun1060?Redirect=Log&logNo=222674172199N레고 21306 비틀즈 옐로 서브마린 리뷰2021-12-17후렴 부분이 너무 좋은 비틀즈 옐로서브마린 ~! 오늘은 제 애장품인 레고 비틀즈 옐로 서브 마린 리뷰를 해볼까 합니다 :) We all live in a yellow submarine Yellow submarine, yellow submarine~ 노래 한번 들으시고 가실게요... 퍼그용사https://blog.naver.com/pswook86?Redirect=Log&logNo=222597826183N'비틀즈 겟 백- 루프탑 콘서트' CGV 아이맥스 포스터/ 아이맥스... 2022-02-19듄, 비틀즈 겟 백' 까지 3연타 관람했습니다... https://blog.naver.com/aj5500/222646284700 애초 아이맥스 체험전 상영작인 '덩케르크'와 '듄'만 보려고 했지만....전혀 예상 외의 '비틀즈 겟 백' 까지 아이맥스 예매가... 전단지 총각의 영화창고https://blog.naver.com/aj5500?Redirect=Log&logNo=222651737593N레고 21306, 레고 아이디어스 비틀즈 노란잠수함(옐로우... 2021-09-15소형 레고부터 차근차근 시작을 해야되기에 창고에서 파괴왕이랑 같이 만들만한 레고 월E 랑 비틀즈... ㅋㅋ 그렇게 파괴왕의 선택을 받은 레고 아이디어즈 비틀즈 옐로우 서브마린 레고 아이디어즈 시리즈... GENZERhttps://blog.naver.com/hjin066?Redirect=Log&logNo=222506272514N[라스베가스 공연 정보] 라스베가스 비틀즈 러브 쇼... 2022-04-08라스베가스 / 미국 여행 / 미국 서부 여행 라스베가스 공연 / 라스베가스 쇼 / 비틀즈 러브 쇼 안녕하세요 라스베가스 매니아입니다! 음악계에 한 획을 그은 전설적인 존재 비틀즈 그룹 노래에 맞춰... 여행 플래너 라스베가스 매니아의 미국 서부 투어https://blog.naver.com/welasvegas?Redirect=Log&logNo=222667772693N소장 가치가 있는 비틀즈 콜라보레이션 카드-굿디자인2021-11-22소장의 가치가 있는 비틀즈(The Beatles) 카드 프리미엄 덱 우리가 즐겨 하는 서양식 카드가 비틀즈와 협업하여 탄생한 The Theory 11 Beatles Playing Card Premium Deck. 이 카드 세트는 리버풀 출신의 세계적인 밴드... 하늘소 블로그https://blog.naver.com/artlife?Redirect=Log&logNo=222575941520N청주에서 비틀즈를 만날 수 있는 곳 다락방의 불빛 전시2021-12-13비틀즈의 모든 것 알아보기 비틀즈는 세계적으로 유명한 가수인데요, 아마 모르시는 분들은 없으실 겁니다. 이번에 다락방의 불빛에서 비틀즈 전시를 진행한다고 하여 궁금한 마음에 다녀왔습니다. 다락방의... 청주시청 공식 블로그https://blog.naver.com/cjcityblog?Redirect=Log&logNo=222592158382",,,,,,,,,,,,,
-,스키틀즈,"1,210","5,630","6,840","7,939",1.161,높음 (15),"N신 가루 있는 스키틀즈 사워 구하기2022-03-26스키틀즈도 내가 가장 좋아하는 간식거리 중 하나였다. 젤리와 사탕 사이의 겉바속쫀 질감 겉에 흰색... 그 언저리의 어느 해, 편의점에서 파우치 모양 패키지에 담긴 스키틀즈 사워를 사먹는데 흰 가루가... HLhttps://blog.naver.com/hyunlong24?Redirect=Log&logNo=222683469658N중국 대륙 광저우 스키틀즈 SKITTLES 젤리를 소개합니다!!!... 2021-08-21이것이 바로 스키틀즈 젤리 입니다 보통 스키틀즈 (skittles)라고 하면, 딱딱한 캔디류를 생각하시겠지만, 여기 중국에서는 이렇게 젤리류도 팔고 있습니다 참고로 이 제품은 세븐일레븐""에서 구매했습니다... 팬더스타 팬더삼촌https://blog.naver.com/sikkalx?Redirect=Log&logNo=222478886845N커피 네추럴스페셜티", 커피에서 스키틀즈 맛이?2022-04-09스키틀즈 블랜드가 반응이 좋다고 해서, 스키틀즈를 주문하기로 했습니다. 필터커피를 블랜딩으로? 약간 의아했는데 일단 마셔보기로.. 그리고 에티오피아 싱글 아메리카노를 주문했습니다. 핸드드립바... 커피 소개하는 남자https://blog.naver.com/sustaincoffee?Redirect=Log&logNo=222695906305N요리활동, 콩순이 파티가 좋아, 스키틀즈로 무지개 만들기 놀이2020-10-13멜론, 브로콜리등등 좀 더 세세하게 표현되어 있어요~ #빅야채네과일가게 자 이번엔 스키틀즈로 뭘 해볼까요~!!! ^^ 하얀 그릇 위에 스키틀즈를 예쁘게 올려놓고~ !!! 초등학교 때 참 많이 먹었는데요.ㅋㅋㅋ 지금은... 즐거운 니디아https://blog.naver.com/nidia02?Redirect=Log&logNo=222114292970N슈프림 스키틀즈 미첼앤네스 콜라보 자켓 & 사탕 구매 후기... 2021-12-05지난주 릴리즈에 슈프림과 스키틀즈의 콜라보가 있었다!!! 이 옷은 착샷을 보자마자 너무 내... ㅜㅜ 당도 100% 슈프림 스키틀즈는 뜯기 너무 아까워서 아직 미개봉임 ㅎㅎ 그 대신 이렇게 친구들에게 하나씩... Candy Bear 캔디베어https://blog.naver.com/bicky1110?Redirect=Log&logNo=222587180629N[한국마즈(유)] 스키틀즈 요거트향(Skittles Yogurt Flavour)2021-10-18가끔이긴 하지만 단것이 땡길때 즐겨먹는 것이 스키틀즈이다. 짝퉁까지는 아니더라도 비슷한 제품들이... 오리지널 제품을 다 먹자마자 이 제품으로 대체를 해야겠다는. #스키틀즈 #요거트향 #스키틀즈요거트향PARADISE LOSThttps://blog.naver.com/coroner9736?Redirect=Log&logNo=222540077272N혼자 회사에서 먹으려고 산 CU편의점 스키틀즈 요거트향2021-11-17회사에서 먹으려고 이번에도 집 근처인 CU에 들러 이상하게 생긴 스키틀즈 요거트라는걸 샀어요. 당 땡길때마다 혼자 신나게 먹을 생각에 책상에서 과자 앞 뒤를 신나게 찍었습니다. 색이 알록달록한데 초등학생... :)https://blog.naver.com/happybrother?Redirect=Log&logNo=222571398450N콜롬비아  스키틀즈 '핑크 버본'2022-03-10~소리가 난다 콜롬비아 스키틀즈 100g에 25,000원 왜이리 비싸냐? 했더니 '핑크버번' 이었다 추출된 커피는 마시기 직전에 스틱으로 저어주면 맛과 향이 고루 전달 스틱을 사용 하지 않을 경우... 커피 그리고 나https://blog.naver.com/minja777711?Redirect=Log&logNo=222668488824N8월 셋째 주 군것질, 오징어땅콩 매콤치즈 + 스키틀즈 요거트... 2021-08-25스키틀즈 요거트 가격: 1,000원 파는 곳: 이마트24 등 편의점 스키틀즈 원래 완전 좋아하고요? 제일 좋아하는 건 사워로 초록색이다. 신 맛이 당길 때마다 사먹으면 만족스럽다. 물론 덕분에 이를 많이 해먹었지만... 먹기 위해 사는 위장 환자https://blog.naver.com/nowwegom?Redirect=Log&logNo=222483938834N집에서 놀자 : 스키틀즈 색 추출 놀이2020-03-25집에서 놀자 : 초간단 과학놀이 스키틀즈에서 색 추출하기 오늘은 정말 초초초간단 과학놀이입니다.... 준비물은 스키틀즈(혹은 엠앤엠즈)와 흰 접시," 따듯한 물이 전부고요. 스키틀즈를 나열해놓고 물만... welcome to my wonderlandhttps://blog.naver.com/funkyyeb?Redirect=Log&logNo=221871581622""",,,,
-,가나 초콜릿,"2,330","13,500","15,830","70,434",4.449,- (-),"N제크 가나 초코샌드 + 마이구미 포도알맹이 + 톡핑 초콜릿2021-12-10톡핑 초콜릿 두 가지 맛, 그리고 마이구미 포도 알맹이다. 제크 가나 초코샌드 가격: 1,700원 파는 곳: CU,세븐일레븐 등 편의점 나는 제크도 좋아하고 가나 초콜릿도 좋아한다. 초코 땡길 때 편의점 가서... 먹기 위해 사는 위장 환자https://blog.naver.com/nowwegom?Redirect=Log&logNo=222592067191N세븐일레븐 가나 초콜릿 파우치 굿즈 응모 + 실물 후기2022-03-30세븐일레븐 가나 초콜릿 파우치 굿즈 응모 + 실물 후기 세븐일레븐에서 초콜릿 사면 초콜릿 모양 파우치 준다고 해서 편의점으로! 나는 2월 7일에 이벤트 소식을 알고 바로 가서 샀는데 이벤트가 유명해져서? 2월... 메론소다 플레이그라운드https://blog.naver.com/happyaiba?Redirect=Log&logNo=222687038802N가나 밀크티 초콜릿 홍차향 가득2020-12-13이번에 가나 초콜릿 라인으로 신상이 3가지나 나왔는데, 랑드샤쿠키와 티라미수 초콜릿에 이어서 가나 밀크티도 맛보게 되었어요. 처음에는 패키지 디자인과 이름만 보고 가나에서 겨울을 맞아 밀크티를... -에르르네 집。https://blog.naver.com/aeirmeki?Redirect=Log&logNo=222172240857N롯데 가나 초콜릿 밀크 우유 마셔본 후기2021-11-07가나초콜렛은 많이 먹어봤는데 가나초코렛우유는 처음 봤어요ㅎ 가나 초콜릿 밀크는 전용목장의... 부드러운 초콜릿맛을 느낄 수 있습니다. 상단에 스트로우를 꽂아서 마시면 되는 간편함ㅋ 냉장고에... YOLOhttps://blog.naver.com/greensubini?Redirect=Log&logNo=222561210178N새로나온 가나 초콜릿 앙상블 다크 쇼콜라2022-02-10요즘 새롭게 나온 초콜릿 가나 앙상블 후기를 들고 왔습니다. CF를 보면서 '저거 맛있겠다' 했는데 그걸... 가나 초콜릿 앙상블은 티라미수, 휘앙티누, 다크쇼콜라 이렇게 세 가지 종류가 있는데 다크쇼콜라가... 바람, 돌, 그리고 우리..https://blog.naver.com/apple5124538?Redirect=Log&logNo=222644186667N편의점 간식 추천, 가나초콜릿 다크밀크 신상 리뷰!2022-04-04#내돈내산 #초콜릿 #간식리뷰 #편의점간식추천 #편의점2+1 #편의점초콜릿 평소 가끔 가나 초콜릿을 편의점에서 사서 먹는데, 가나 다크밀크 라는 제품이 새로 나왔다. 빨간 초콜릿 밤색초콜릿도 맛있는데, 신상... 리본C의 데일리리뷰https://blog.naver.com/ruxx11?Redirect=Log&logNo=222688471726N가나 앙상블 티라미수 휘앙티누 초콜릿2022-02-16가나 앙상블 티라미수 휘앙티누 초콜릿 안녕하세요. 지난번에 마트에서 샀던 가나 앙상블 요즘 티브이... 취할 수 있을 것 같은 기분 ♡ #가나앙상블휘앙티누 #가나앙상블티라미수 #롯데가나앙상블 #가나초콜릿행복한일상https://blog.naver.com/dusgnsekdls?Redirect=Log&logNo=222648962846N가나 밀크초콜릿 칼로리 달다구리2021-05-15가나 밀크초콜릿 칼로리 달다구리 우리집 냉동실템 바로 가나 초콜릿인데요~ 일 하다가 육아하다가 당 떨어질때 덜덜덜 거릴때는 수혈하듯이 먹는게 바로 요고예요 물론 .... 그 이유가 아니더라도 먹는... 쫑알쫑알이야기공장♥https://blog.naver.com/hhj1004w?Redirect=Log&logNo=222352543900N핑크쿠키볼 (핑쿠볼) / 가나 핑크베리 / 롯데 신상 초콜릿2021-01-28마지막으로, 가나 핑크베리 초콜릿을 확인해보기로 했어요. 핑크베리 가나 초콜릿 114g의 총 칼로리는 660kcal이고, 복분자딸기과즙분말 2.2%, 딸기그래뉼 0.7%가 함유되어 있어요. Ghana(가나)에서 맨 앞의 G를... THE HONG [더홍] 홍의성 - SBS스타킹 영어킹"" 우승자https://blog.naver.com/dxsuckit69?Redirect=Log&logNo=222223597654N[GS25] 가나초콜릿 마카롱 후기2021-11-282일차 #원픽 #꿀템 이번에는 가나초콜릿 마카롱을 먹어보고 후기를 가져왔어요 GS25 신상 디저트는 과연... 가성비 굿굿 마카롱 덕후인 저는 특히 초콜릿 맛을 좋아하는데 어떤 맛인지 너무 궁금하고 특히 블랙... Be Yourself(너 자신이 되어라)https://blog.naver.com/kangsm1998?Redirect=Log&logNo=222581296456""",,,,,,,,,,,,,
-,스누피 커피우유,630,"4,230","4,860","12,302",2.531,낮음 (3),"N스누피 커피우유 카페인(스누피님 제가 잘못했어요)2021-12-05마신 사람들을 깜짝 놀라게 만드는 스누피 커피우유 카페인 함량에 대해 알아봤습니다. 카페인이 필요하실때 드셔보세요! #스누피커피우유 #스누피더진한커피 #스누피우유 #GS25스누피 #커피우유 #스누피카페인블린이의 블로그 모험https://blog.naver.com/tecbae?Redirect=Log&logNo=222586981117NGS25 3월행사 스누피 커피우유 득템2022-03-037 행사상품: 스누피 우유(250ml) 1+1 (커피, 초코, 딸기) 행사가격: 1,000원 1+1이라서 저는 딸기맛, 와이프는 커피맛 요렇게 스누피 우유 2개를 사이좋게 가져왔어요. 스누피 커피우유 딸기우유 원래 판매가격은... 별별리뷰의 세상 모든 리뷰https://blog.naver.com/sinho81?Redirect=Log&logNo=222662320640N스누피커피우유 카페인 함량 체크2022-01-28스누피커피우유 카페인 스누피우유는 커피맛 말고도 초코 딸기 등 종류가 더 있다. 초코맛과 딸기맛 순간 끌렸으나 원래 계획했던 거 사는걸로. 스누피커피우유 카페인 커피우유고, 예전에 유투브에서... 책 그리고 경험과 소비의 재해석https://blog.naver.com/avril_belle?Redirect=Log&logNo=222633402119N비요뜨 등) GS25 편의점 스누피 커피우유, 애플망고 젤리 리뷰2021-06-242+1상품 시험 공부중인 아이가 부탁한 스누피커피우유 ㅎㅎ 커피우유만 샀는데 식빵을 서비스로 GS25 6월 한달 동안 스누피 우유를 사면 브래디큐 식빵 25 무료로 준대요. 요 커피 우유가 좀 진한가봐요. 시험... 건강하고 야무진 Smart Lifehttps://blog.naver.com/skc9528?Redirect=Log&logNo=222408496775N[커피로그. 스누피 커피우유] 3차 백신 3일차!2022-01-19정신을 차리고도 너무 피곤해서 집 앞에 편의점에서 [스누피 커피]랑 [해피뉴이어 초코파이]를 사 와서 당, 카페인 충전으로 억지 텐션을 올려보려고 해도 도저히 피곤함이 사라지지가 않더라고요.. (포스팅을... 찌수's Daily 소통 블로그https://blog.naver.com/qkrejrwk0810?Redirect=Log&logNo=222626217588N스누피 커피우유 카페인, 영양성분, 맛 후기2020-12-08스누피 커피우유 앞면에는 귀여운 스누피가 헤드셋을 끼고 인라인 스케이트를 타고 있네요 ^^. 하단에는 커피맛우유 | 가공유 | 250ml(155kcal) 커피파우더 0.28%, 총 카페인함량 33mg 으로 적혀있습니다.... 내 맘대로 블로그https://blog.naver.com/skw6935?Redirect=Log&logNo=222166276451N편의점 베스트, 고 카페인 더 진한 : 스누피 커피우유2022-03-19리모모예요:) 집 근처 편의점 갔더니 스누피 커피우유가 눈에 띄더라구요! 예~전에 스누피 커피우유 처음 나왔을 때 고 카페인이라 마시면 잠 못 잔다 이런 얘기를 많이 들었어서..ㅎㅎㅎㅎ 오랜만에... 리모모 데일리룩 블로그https://blog.naver.com/z1naz1?Redirect=Log&logNo=222677205435N씨유 스누피 커피우유2022-02-17반가운 우유를 만났어요. 바로 씨유 스누피 커피우유인데요. 어렸을 때 시험기간이면 밤샘 공부한다고... 지금도 카페인은 많이 들어있는 것 같은데, 저도 그동안 커피도 많이 마시고 카페인에 대해 많이... §§ b e d s p o r §§https://blog.naver.com/bedspor33884?Redirect=Log&logNo=222650637066NGS25 스누피 커피우유 ‘더 진한 커피’ 카페인이 필요할때... 2021-07-23암튼 이웃님들도 더운 날씨에 건강 잘 챙기시고 불금인 오늘도 행복하세요^^ #스누피커피우유 #스누피더진한커피 #커피우유추천 #커피우유리뷰 #고카페인 #고카페인커피우유말벗의 일상 블로그https://blog.naver.com/mylove1005?Redirect=Log&logNo=222442139201N[일상] 스누피 커피 우유2020-11-06그런가 스누피 커피우유 진짜 맛있어요ㅋㅋㅋㅋ 어제 먹으면서 달아! 맛있어! 하면서 다 마신...ㅋㅋㅋㅋ 카페인만 아니면 그냥 바나나 우유처럼 마실텐데 아쉬워요 ㅠㅜㅠ ((근데 스누피 우유 짱은 초코우유....소소한 일상의 숲https://blog.naver.com/forest2809?Redirect=Log&logNo=222136843167",,,,,,,,,,,,,
-,하리보,"5,500","21,200","26,700","178,281",6.677,- (-),"N마곡네일 루씨드뷰티살롱에서 하리보 곰돌이 수제네일2022-03-13아무튼 요 하리보 곰돌이 수제 네일로 선택! 가격표 왁싱, 속눈썹, 네일 가격표! 시술 내용에 따른 추가... 선택한 하리보 곰돌이네일 너무 귀여웠음 ㅋㅋ 투명 곰돌이 안쪽에 반짝이 있는데... 사진에 잘 안... 달콤 비https://blog.naver.com/haha3587?Redirect=Log&logNo=222671473120N인싸가 될 하리보 피크닉 돗자리2022-04-11100년의 역사를 자랑하는 젤리회사하면 바로 떠오르는 하리보가 그려진 피크닉 돗자리가 있어요 들고... 돌아와 하리보 피크닉 돗자리의 가장 큰 핵심포인트라고 한다면 가방이 아닐까 싶어요 왕크니까... Sunny Househttps://blog.naver.com/skywingbuzz?Redirect=Log&logNo=222697281493N크리스탈 헤이즈 하리보 목걸이 직구 방법 @ 하입비스트2021-11-28저는 야식 먹고 배불러서 지금까지 안 자고 있네요 ㅎㅎ 오늘은 크리스탈 헤이즈 하리보 목걸이... 두 주먹을 앙 쥔 거 같은 깜찍한 곰돌이를 만날 수 있어요~ 가까이서 보니 왜 하리보라고 하는지 알 것... SALON DE J.https://blog.naver.com/jiny_home?Redirect=Log&logNo=222580632563N[베를린] 독일에서 선물하기 추천! 나만의 커스텀 하리보 만들기2022-03-11나의 사랑 너의 사랑 우리의 사랑 하리보! 하리보 홈페이지에서 커스텀 주문이 가능한거 아시나여~ 선물로 종종 만드는데 꽤 괜찮다. 일단 https://onlineshop.haribo.com/ 하리보 온라인 샵에 들어가면 이 항목!... 베를린 살롱https://blog.naver.com/sweetkkubi?Redirect=Log&logNo=222669776538N크리스탈 헤이즈 하리보 목걸이 직구 @ hbx SALE + 15%2022-03-30크리스탈헤이즈 / 하리보 목걸이 크리스탈헤이즈 AKA 하리보 목걸이 입니다. 요 몇년 전부터 유행 하고 남성이고 여성이고 모두에게 인기 여자분들은 연령대 가리지 않고 인기 입니다. 크리스탈헤이즈 직구... 써머즈의 쇼핑이야기https://blog.naver.com/halims83?Redirect=Log&logNo=222686863828N피크닉 매트 귀여운 하리보 돗자리로 나들이2022-04-10나들이 할 때 갖고 다니면 좋을 넓직한 피크닉 매트 아이가 좋아하는 하리보에서 나왔길래 겟했어요. 보관가방까지 패키지로 나와서 갖고 다니기에도 좋고 방수도 되는 재질이다보니 요긴하네요. 하리보... Dreaming whale's Delicious & Beautiful Dayhttps://blog.naver.com/kkamrabbit?Redirect=Log&logNo=222696790703N하리보 시리얼볼4P / 스푼 앤 포크 : 막 꺼내주기 좋은 아이식기!2021-12-06오늘은 친척언니에게 선물받은 하리보 식기를 소개해볼까 합니다! 아이들 간식 식기로 너무 잘 사용하고있고 수저도 밥수저로 애용중인 하리보 식기! 소개해볼게용? 하리보 시리얼볼 4P set 시리얼볼 먼저... 이브나의 인생놀음https://blog.naver.com/b920914?Redirect=Log&logNo=222587732068N하리보 골드베어 스프링에디션2022-02-28하리보 골드베어 스프링에디션 편의점 젤리 코너에도 봄이 등장했지요. 하리보에서 신상 아닌 신상품이 나왔더라고요. 보자마자 냉큼 구매를 해왔답니다.ㅎㅎ 편의점에서 구매 가격은 2,000원이에요. 이번 2월... Mystery Black Rabbithttps://blog.naver.com/redflower836?Redirect=Log&logNo=222659946192N맛있는 하리보 젤리 종류 추천 골드베렌 스타믹스 웰치스젤리... 2022-03-14그 중에는 제가 좋아하는 하리보 젤리도 있는데요. 오늘은 제가 맛보았던 하리보의 여러가지 젤리를 소개해 드릴까 합니다. 하리보에는 여러가지 젤리가 있는데요. 독일이 원산지인 이 젤리는 무려 125종... 정보의 공유https://blog.naver.com/ahspzk2000?Redirect=Log&logNo=222672787847N하리보젤리 칼로리 충치유발지수는?2022-02-15하리보젤리 칼로리 충치유발지수는? 원래 저는 젤리를 좋아하는 편이 아니었어요. 근데 근무시간에... 큰 봉지보다 작은 봉지의 하리보가 더 딴딴해서 식감도 좋고 맛있게 느껴져요. 그래서 순식간에 앉은... 태콩이의 세상이야기https://blog.naver.com/hhasd112?Redirect=Log&logNo=222648343949",,,,,,,,,,,,,
