-,키워드,PC 검색량,모바일 검색량,총조회수,문서수,비율,블로그순위 ▼,,,,,,,,,,,,,,
-,짜파게티,"4,470","30,000","34,470","359,071",10.417,- (-),,,,,,,,,,,,,,
-,햇반 아이스크림,"3,000","27,000","30,000","28,178",0.939,- (-),,,,,,,,,,,,,,
-,삼양라면,"4,110","20,100","24,210","108,506",4.482,- (-),,,,,,,,,,,,,,
-,진라면,"3,500","12,900","16,400","158,371",9.657,- (-),,, 러블리라이프??https://blog.naver.com/zooty7979?Redirect=Log&logNo=222572225650N진라면X카카오프렌즈 콜라보... (라이언 모래시계/진라면 라이언)2021-01-28진라면과 카카오프렌즈의 콜라보 굿즈 사진을 보는 순간," ""아아 이건 사야해"" 라는 지름신의 계시가... 싸인에 얼른 라이언을 들고 아기 책장 위로 피신ㅋㅋㅋ 진라면 요리사 라이언의 앞",왼쪽,뒤,오른쪽... ♥설탕새♥https://blog.naver.com/jsa1820?Redirect=Log&logNo=222223630139N컵라면 볶음밥 진라면 신박한 혼밥메뉴 라면요리2021-09-16컵라면 볶음밥 진라면으로 만든 라면볶음밥/초간단 혼밥메뉴 초간단한 집밥 메뉴를 요리하고 소개하는... 집에 진라면 매운맛이 있어 사용했는데 계란이 들어간 참깨라면을 많이 드시더라구요~ 아이들은... 해피레시피 류이https://blog.naver.com/76boragom?Redirect=Log&logNo=222508074287N파가마니 라면. 진라면을 더욱 맛있게2021-07-09중국에서도 진라면 매운맛. 진맵을 쉽게 살 수 있게 되었어요. 할인권 받아서 142위엔에 40개, 한국돈으로 600원이 조금 넘는 수준이니까 수입 치고는 싼 편이죠. 오뚜기 = 不倒翁, 진라면 = 金拉面으로 검색하면... Randyhttps://blog.naver.com/objoe?Redirect=Log&logNo=222425585708N해외입국격리 -1일차. 신라면이여~ 진라면이여~~2022-02-25신라면이 안하면 진라면이라도 하세요.ㅎㅎ) 그렇게 짭짜름한 닛신라면을 국물까지 말끔히 마신 F손님과는 반대로 국물을 반만 남긴 D손님. 갑니다. 간다구요. 밥은 언제주지? 기억에, 예전에는 3번의 기내식이... 맛, 멋, 그리고 여유https://blog.naver.com/fredylisa?Redirect=Log&logNo=222657304547N진라면 맛있게 끓이는 법, 황태 진라면 해장에 아주 좋아요~2022-03-26아이들은 비비고전복죽을 주고 오늘은 진라면 맛있게 끓였습니다. 먼저 황태 한주먹을 잡고 물에 세... 오늘의 메인 진라면입니다. 세상에 이해할수 없는 음식이 있습니다. 진라면 순한맛. 전자렌지 돌린 3... 캠핑과 식물 그리고 일상https://blog.naver.com/aerok9?Redirect=Log&logNo=222683451803N진라면 보드게임 플레이 후기," 친숙한 라면으로 재미있게 즐기자2021-09-06가진 진라면 보드게임에 대해 필자가 직접 플레이해보면서 얘기해보고자 합니다. 이 게임의 경우 오뚜기와 정식적으로 콜라보를 하면서 탄생했으며 한국에서 가장 많이 팔리는 라면 중 진라면을 바탕으로 하는... 청비대제(청룡비둘기)의 휴식공간https://blog.naver.com/dbsgns2011?Redirect=Log&logNo=222497379297"""
-,스낵면,"1,420","8,680","10,100","23,245",2.301,- (-),,,,,,,,,,,,,,
-,너구리,"11,100","56,100","67,200","518,299",7.713,높음 (3),, 강릉 엄지네포장마차 팝업스토어가 열리면 사 먹곤... 원주 너구리포차 원주시 개운로 59 033-765-3010 매일 13:00-01:00 원주 너구리포차 - 외부 꼬막비빔밥으로... 제이 그리고 제이네 -https://blog.naver.com/dia_estival?Redirect=Log&logNo=222695112375N레고 미니피규어 시즌22 너구리 알바2022-02-16가장 인기가 많은 듯 한 속칭 '너구리알바', 매번 발매를 할 때, 인형탈을 쓰고 있는 피규어가 1~2개... 귀여운 너구리~ 꼬리 표현 및 프린팅이 정품답게 매우 좋습니다. 이전 시리즈에는 인형탈 이외에는... julyairline님의 블로그https://blog.naver.com/julyairline?Redirect=Log&logNo=222649490745N반요 야샤히메 2기 10화 - 너구리 일족과의 악연2021-12-06깨어난 모로하는 만월 너구리와 쇼겐에게 되갚아주려고 뗏목을 타는데 마침 오늘은 달이 뜨지않는... 그전에 하치에몽에게 자신의 부모가 어떻게 만월 너구리와 쇼겐을 쓰러뜨렸는지 이야기를 듣는데..... 내친구 타마마https://blog.naver.com/28686?Redirect=Log&logNo=222588121136N먹고 알콜프리하고 볶음너구리에디션먹고 모닝캄커피랩 갔당 ~2022-03-31이날 역대로 술 많이 먹고 집 왔는데 갑자기 볶음 너구리 해줌 근데 이거 볶음너구리 에디션 이거이거 두개에 4500원인가 그렇대 이제 안나와서 뭐라나.. 뭔 다 플미를 붙여 어이없게 ;; 어이없게 근데 존맛이였음... maaaaang_https://blog.naver.com/maaaaang_?Redirect=Log&logNo=222687492491N고양이가 있는 삶(feat,너구리)2022-04-03고양이가 있는 삶 (feat, 너구리) - 어릴 때 햄스터, 병아리, 달팽이를 키워본 게 다인 나 고양이나... 고양아, 너구리야라고 불렀다 동그란 얼굴 굽은 귀," 스코티시 폴드 너구리ㅜㅜㅜㅜ 고양이랑 친해지는 법... 요요작업실https://blog.naver.com/shinjy201?Redirect=Log&logNo=222690468363N원주 꼬막비빔밥 '너구리포차'(원주 맛집)2022-04-04안주로 뭐 먹을까 ~ 하다가 급 꼬막비빔밥이 땡겨서 너구리 포차에서 포장하고 왔답니다 너구리포차는 원주고등학교랑 상지여자고등학교 사이에 있어요 ! 정~말 오랜만에 온 이 골목 ! 도말사거리에서 한 블록... 여기서 행복할 것https://blog.naver.com/kma0016?Redirect=Log&logNo=222691464433""",,,,
-,자가진단키트,"46,300","341,700","388,000","105,786",0.273,- (-),,,,,,,,,,,,,,
-,테라,"12,800","27,600","40,400","716,695",17.74,높음 (15),"N김혜수 마스크 아이테라 내돈내산 솔직 후기2022-04-02누아누아 아이 테라 김혜수 새부리형 원킬 구리 마스크 1SET / 10매 바로 아이테라 마스크인데요 가격이 굉장히 비쌌어요 10개들어있는게 한 세트인데 23,900원에 판매 중이더라구요 여기에 배송비까지 부치면 개당... 뷰티 데일리 @이람님https://blog.naver.com/qmfosej?Redirect=Log&logNo=222689578420N1테라외장하드복구 빠르게 가능한 곳2022-04-121테라외장하드복구 빠르게 가능한 곳 요즘 제가 집에서 작업을 하다 보니까 해야 할 게 산더미더라고요.... ?? 그래서 1테라외장하드복구가 빠르게 가능한 곳에 대한 후기들을 찾아봤거든요? 근데 저처럼... 비트컴퓨터온컴즈https://blog.naver.com/mansaa?Redirect=Log&logNo=222699051235N테라팰리스 건대4차 오피스텔 분양가 안내2022-04-08테라팰리스 건대4차 오피스텔 분양 소식 준비 했습니다. 단지는 서울시 내 10여개의 지하철 노선 중 가장 핫한 황금노선으로 통하는 지하철 2,7호선의 더블역세권인 건대입구역 인근에 신축 공급 됩니다. 테라... Haute couture ♥https://blog.naver.com/jms900206?Redirect=Log&logNo=222695463514N테라팰리스 건대4차 오피스텔 공급정보2022-04-05테라팰리스 건대4차 오피스텔 공급정보 전국 아파트의 거래량을 확인해보면 관망하는 분위기로... 오늘은 위와같은 요건을 충족하고 있는 현장인 테라팰리스 건대4차에 대해 알아보도록 하겠습니다.... 럭셔리여우별스토리https://blog.naver.com/zammw2002?Redirect=Log&logNo=222691647088N구리 갈매 현대테라타워 모델하우스 분양가 공급2022-04-11구리 갈매 현대테라타워 모델하우스 분양가 공급"" 부동산 투자가 필수가 된 시대입니다. 특히 임대수익을 얻을 수 있는 분야를 알아보는 분들이 늘어나고 있습니다. 오늘은 구리 갈매 현대테라타워에 대한... 리치하우스https://blog.naver.com/crazycsd?Redirect=Log&logNo=222697449441N테라팰리스 건대 4차 분양정보2022-03-18테라팰리스 건대 4차 최근 오피스텔 트렌트는 아파트를 대용할 수 있는 형태로 공급되기 때문에... 그래서 테라팰리스 건대 4차에 대해서 살펴보겠습니다. 서울 광진구 화양동에 지어진 오피스텔로 단지는... LifeCodihttps://blog.naver.com/sp0110?Redirect=Log&logNo=222676080137N테라팰리스 건대4차 오피스텔 분양정보2022-03-25테라팰리스 건대4차 오피스텔 분양정보 전국의 아파트 거래량이 눈에 띄게 감소한 반면에 도생이나... 따라서 오늘은 이러한 여건이 충족되어서 큰 관심을 받고 있는 현장을 소개해볼까 하는데요"," 바로 테라팰... 그린라이트https://blog.naver.com/yess888?Redirect=Log&logNo=222682804563N테라팰리스건대4차 오피스텔 분양 소식2022-04-06갖춘 테라팰리스 건대 4차 오피스텔 분양 소식에 대해 살펴보도록 하겠습니다. 생활편의 및 접근성이 뛰어난 입지를 바탕으로 차별화된 내부 설계가 돋보이는 테라팰리스 건대 4차 오피스텔은 최근 분양하는... 나의 간판https://blog.naver.com/zellsee7?Redirect=Log&logNo=222693438025N봄내음 나는 강화도펜션 독채 테라롯지 동막해변도 마구... 2022-04-08강화도펜션 테라롯지로 리플레쉬여행 다녀왔습니다~ 친구들은 얼마만의 자유인지~동막해변에... 강화도독채펜션 테라롯지 까지는 차로1분?밖에 걸리지 않는 아주 가까운 거리였구요 도보로도 10분이 채 걸리지... 인피니티https://blog.naver.com/uriky?Redirect=Log&logNo=222686803340N오산 세교지구 현대테라타워 지식산업센터 공급정보2022-02-28현대테라타워가 주목받고 있어 소개해 드립니다. 우선 규모부터가 압도적으로 경기대로 일원의 자족... 오산 세교지구 현대테라타워의 라이브오피스는 내부에 다락과 욕실이 설치되는 구조로 근무 교대 시에... 슬기로운 공유생활https://blog.naver.com/physication?Redirect=Log&logNo=222660147828""",,,,,,,,,,,,
-,처음처럼,"4,170","24,300","28,470","435,260",15.288,중간 (10),"N제니처럼 예쁜 처음처럼 소주 광고 보면서 나도 홈술해보기2022-01-18평소처럼 드라마를 보기 위해 TV 앞에 앉아 있었는데 처음처럼 제니 새로운 광고 보고 넋을 잃고... 부드러운 처음처럼이 찰떡궁합이라 CF보는 재미가 있었다. 제니의 일상로그를 보는 것 같기도 했다. 좋아요... 먹기 위해 사는 위장 환자https://blog.naver.com/nowwegom?Redirect=Log&logNo=222624990037N수원미용실 처음처럼클리닉했지요2021-10-06이번에 처음처럼클리닉으로 받았는데요 푸석푸석 건조하고 뒤엉컸던 머리카락은 사라지고 머릿결에서... 그중에서 처음처럼클리닉으로 해줬어요 지난달인가 펌을 한 것 같은데 펌기를 조금 풀고 싶기도 하고... 허씨어뭉의 우아한 봄날https://blog.naver.com/shsh1635?Redirect=Log&logNo=222528793916N처음처럼님의 희귀식물 온실 공감 story 방문2022-04-09처음엔 작은 식물들이 반겨주었다. 여러 가지 싱고니움 종류들과 머럴막스 바리에가타가 눈에 들어온다. 작년 여름 화려한 잎으로 즐거움을 주었던 칼라디움 처음처럼님의 온실은 고온다습해서 가을 겨울에도... 결국엔 해피엔딩https://blog.naver.com/merci87?Redirect=Log&logNo=222695985651N강릉 강문해변 횟집, 처음처럼 횟집 모둠회2021-12-16강릉 강문해변 횟집, 처음처럼 횟집 모둠회 관광객이 많이 찾는 유명 해변인지라, 바다가 보이는... 아직 이른 시간, 밝을 때 찾은 처음처럼 횟집. 강문 해변에서 안쪽으로 한 블록 들어온 길에 있다. 낮은 건물... 푸드그래퍼 울프강_음식사진, 영상제작https://blog.naver.com/kdhnim?Redirect=Log&logNo=222597180890N광교미용실 가르마헤어 처음처럼 클리닉 후기 광교점 뿌염 2+1... 2022-02-14광교미용실 가르마헤어 처음처럼 클리닉 후기 광교점 뿌염 2+1 행사중이예요 광교미용실 가르마헤어 처음처럼 클리닉 후기 광교점 뿌염 2+1 행사중이예요 안녕하세요~ 레비올라예요. 요즘 머리 복잡한 일들이... 레비올라의 play groundhttps://blog.naver.com/mamon08?Redirect=Log&logNo=222647425196N강릉 강문해변 횟집 : 처음처럼횟집2021-12-14횟집 : 처음처럼횟집 동네 한바퀴 돌아보고 느낌 오는 곳으로 입장. 꽤 널찍했던 매장. 사장님과 이모님 한 분이 계셨고, 저녁 시간이 되니 알바생이 한 명 오더라고요. 착석. 강릉 강문해변 처음처럼횟집 메뉴.... Blaack Loghttps://blog.naver.com/bsb7411?Redirect=Log&logNo=222594043270N웨딩밴드 항상 처음처럼~2021-11-18그래서 최종적으로 보여드린 것 중에 신상으로 출시한 이 모델을 봤는데 처음에는 갸우뚱 하다가... 항상 처음처럼이라는 문구로 각인을 하셨어요. 결혼을 하게 되면 어느 한쪽이든 변함이 있다고 하죠^^ 두분... 디유953 #청담동예물 #청담커플링https://blog.naver.com/gmcurrahee?Redirect=Log&logNo=222572187074N광교미용실 가르마헤어 쿤원장님 처음처럼크리닉 기적같쿤2021-11-08안녕하세요 사슴이언니 태희입니다 극손상모인 제게 크리닉은 마치 월례행사랄까요 처음처럼... 지경 처음처럼 크리닉 인계동 본점에서도 제 헤어를 담당해주셨던 쿤원장님인데요 항상 가능한 만큼만... 사슴이언니의 물욕넘치는 일상 : 옷사입고 여행가고https://blog.naver.com/xogml1814?Redirect=Log&logNo=222561464739N처음처럼 도수 16.5도로 리뉴얼!! 기분 좋게 홈술 한잔... 2021-03-04처음처럼 도수 16.5도로 홈술과 혼술로 한주의 피로를 기분 좋게 풀어봅니다~ 남편도 그렇고 저도 그렇고... 그런데 이번에 리뉴얼된 처음처럼은 저도 두 세잔은 같이 나눌 수 있겠더라고요 남편이 그 모습 보더니... 은솔희섭mom의 데이바이데이 story~*https://blog.naver.com/psy9133?Redirect=Log&logNo=222263935791N처음처럼 빠삐코 vs 메로나에 이슬 저의 선택은2022-01-28하지만, 또 저를 궁금증에 빠져들게 하는것이 있었으니, 처음처럼 빠삐코 '처음처럼 빠삐코라니.. 이게 정말 소주야?' 처음 봤을때.. 먼저 든 생각. 정말 생각지도 못한 조합이죠? 한정판으로 나왔다는 소식을... 루크맘의 맛있는 집♡https://blog.naver.com/maximusc?Redirect=Log&logNo=222634107400",,,,,,,,,,,,,
-,참이슬,"4,640","25,900","30,540","282,697",9.257,- (-),"N스트레스 받을 때 빨간맛 산남동 시골애 낙지볶음 맛집 + 참이슬2022-04-082인과 참이슬 한 병을 주문했다 세트메뉴도 있었는데 새우튀김에 진심은 아닌편이라 굳이 새우튀김도 드실 분들은 세트메뉴가 조금 더 저렴하긴 하다 시골애 기본반찬 콩나물과 무나물은 낙지볶음과 밥을... 눈깜짝할사이https://blog.naver.com/asdzxc0890?Redirect=Log&logNo=222694079425N참이슬 같은 맑은 향기 겨울에 잘 어울리는 찻잔에 꽃 국화차로... 2021-12-13특별히 내가 좋아하는 향기에 대해 이야기해 주세요~ 참이슬 같은 맑은 향기 겨울에 잘 어울리는 향기를... #찻잔에꽃차당 #국화차효능 #참이슬 #국화꽃향기 #토끼풀향기 #좋아하는향기 #겨울에잘어울리는향기꿈꾸는 돌멩이https://blog.naver.com/oksu3143?Redirect=Log&logNo=222593947274N201220 아이유 참이슬 새 화보_ 신뢰로 쌓아올린 브랜드의... 2020-12-20아이유 X 참이슬 2014 ~ 2018 AGAIN 2020 아이유 참이슬 재계약 단상_ 상호 신뢰로 빚어진 아름다운 결연 참이슬X아이유_ 보그 시크릿파티 메이킹필름 아이유 참이슬 재계약 단상_ 상호 신뢰로 빚어진 아름다운 결연... I U H O L I Chttps://blog.naver.com/smotherguy?Redirect=Log&logNo=222179892305N운명의 숙적, 참이슬 VS 처음처럼! 말술남녀가 파헤쳐봤습니다2021-05-26처음처럼이나 참이슬, 카스, 하이트같은 평범한 술말고도 와인, 사케, 위스키, 고량주, 전통주 등... 참이슬 vs 처음처럼 을 꼽았어요 인정? 어~ 인정!ㅎㅎㅎㅎ #소맥마는법 소맥을 맛있게 먹는 저만의 방법도... 푸드디렉터 김유경의 테이스티코리아https://blog.naver.com/angela8846?Redirect=Log&logNo=222368240547N[받았다] 진로이즈백 굿즈 참이슬 백팩2021-09-03참이슬이 존재하지 않던 시절, 그땐 집 냉장고 어디서나 늠름한 두꺼비 한두병쯤은 쉽게 만나볼 수... 뭐....뭐고 이게 네, 어쩌다보니 집에 참이슬을 박스채 여러개를 한번에 구매 할 일이 있었는데, 마침... 미샤의 뒤죽박죽 블로그https://blog.naver.com/mishalove?Redirect=Log&logNo=222493824657N참이슬 일본 광고 - 한국드라마로 배우는 연애지침서 ㅋㅋㅋ2021-12-17제목부터 웃기는 참이슬 광고ㅋㅋ 4분 가량의 광고로 웹 바이럴용 CM이고 12월 16일에 공개되었다. #K로코 클리셰를 몽땅 털어 넣고 만든 참이슬 일본 광고 함께 보시죠ㅋ 영화 진짜 재밌었어~ 라고 말하며... Siesta♡https://blog.naver.com/yemingom?Redirect=Log&logNo=222597481360N아이유(IU) 참이슬 모델 재발탁! 무려 8년째 인연2022-03-24아이유가 참이슬 모델로 재발탁 되었다는 기사가 떴다. 계약 연장(?) 이라고 보면 될 것 같다. 실력과 미모까지 모두 겸비하고 맑고 깨끗한 이미지의 아이유가 참이슬의 이미지를 올려주는 듯! 메이킹... 일상과 덕질 그 사이 어딘가https://blog.naver.com/baeksujin91?Redirect=Log&logNo=222681956550N[굿즈] 테라X참이슬백팩 프로모션2021-01-29테라 x 참이슬백팩입니다. 저는 핸드카트가 탐났지만 저희남편은 무조건 참이슬백팩이어야한다고.... 네... 사십시오.. 바로 이 구성입니다. 아래 큰 박스에 테라캔이 24캔 들어있구요 (6팩씩 4묶음) 참이슬백팩이... 일상의 행복。https://blog.naver.com/cherrypoodle?Redirect=Log&logNo=222224466225N소주 값 인상..? 참이슬 출고가 7.9% 인상2022-02-1923일부터 참이슬과 진로 제품 출고 가격을 7.9% 인상한다고 밝혔는데요 360㎖ 병과 일부 페트류가 인상 대상이라고 합니다. 하이트진로의 소주 값 인상은 지난 2019년 4월 이후 약 3년 만인데요 이 정도면 엄청... WONDER VAPE 강남https://blog.naver.com/apple0006175?Redirect=Log&logNo=222652188054NBTS... 참이슬 처음처럼을 모른다고?2021-07-20특히 한국의 소주 참이슬과 처음처럼에 대해서도 심도있는 마케팅 수업을 하였는데 미국에서 가장... 1위가 참이슬 2위가 스미노프 보드카 3위가 처음처럼 우리 아빠 한게임 닉네임도 참이슬 이다... ㅡ,,ㅡ... 백두건스키 / 보드 강습팀https://blog.naver.com/2vent6?Redirect=Log&logNo=222438658218",,,,,,,,,,,,,
-,네이처,"7,890","52,600","60,490","585,299",9.676,높음 (15),"N대구 네이처파크 아이랑 가볼만한 곳 다녀왔어요!2022-04-13대구 네이처파크 아이랑 가볼만한 곳 다녀왔어요! 안녕하세요! 가온이 아빠입니다. 이번 주말 엄청... 간단하게 토요일,일요일 일정은 토요일 오전 대구 네이처파크 오후 양산 황산공원 일요일 경마공원 근처... 전투육아시작https://blog.naver.com/skfktjdwn1?Redirect=Log&logNo=222699348458N6. 오토 캠핑/강원도 인제/러빙네이처 캠핑장2022-04-07일시 2022.02.27 - 2022.03.01 장소 강원도 인제 러빙네이처 캠핑장 주소 강원 인제군 남면 설악로 1129 정보... 러빙네이처 캠핑장은 명당자리가 아닌 2층의 그것도 사이드에 위치한 곳이라 갈까말까 다른날로 다시... 디얼줄리엣 블로그https://blog.naver.com/dear_juliet?Redirect=Log&logNo=222693899592N시카 마스크팩 병풀추출물 담은 비건시트 뷰티코드네이처2022-03-27코드네이처 비아미 시카 앰플 마스크 27g*10매. 아름다움을 향한 각기 다른 ‘니즈’를 트렌디한 ‘코드’ 네임으로 쉽게 제안하는 뷰티코드네이처의 시카 앰플 마스크는 제가 피부 진정 필요할 때 자주 찾는... 조아하늬 뷰티 in 패션https://blog.naver.com/mhsi0501?Redirect=Log&logNo=222684082888N캠핑용품 네이처하이크 클라우드 업 시리즈 초경량 캠핑텐트... 2022-03-31캠핑용품 네이처하이크 클라우드 업 시리즈 초경량 캠핑텐트 큐텐 직구 구매 쉽네 따뜻한 봄의 시작과... 통해 네이처하이크 클라우드 업 시리즈 초경량 캠핑 텐트를 영입하게 되어 소개를 하는 시간을... 김프로 캠핑야그https://blog.naver.com/gasinae00?Redirect=Log&logNo=222687079965N고양이신장사료 크랜베리가 들어간 프로네이처2022-03-30고양이신장사료 크랜베리가 들어간 프로네이처 이 브랜드라면 언제나 믿고 급여할 수 있어요... 프로네이처라면 망설임없이 고르게 되는 것 같아요 단, 엄격한 검증 절차를 거친 공식 판매처인 러브유어펫임을... 수댕쓰https://blog.naver.com/skstbvjcjqj?Redirect=Log&logNo=222686552247N네이처메이드  여성칼슘제추천! 칼마디!!2022-03-21네이처메이드 칼슘 마그네슘 비타민D @글과 사진 하이시드니 사실 지난 건강검진에서... 골밀도... 오늘은 네이처메이드 칼마디! 흡수에도좋고 먹기도 편한 칼슘+마그네슘+비타민d 영양제를 소개할께요!... 하이 시드니 Hi, sydneyhttps://blog.naver.com/andoo7?Redirect=Log&logNo=222678599376N고양이신장사료 프로네이처 칠면조 & 크랜베리 고양이 사료 추천!2022-04-01프로네이처는 전 세계의 자연과 산물에 고유한 레시피에 영감을 받아 특별한 반려동물 사료를 탄생시킵니다 고양이신장사료로도 유명한 프로네이처는 반려 고양이의 연령과 건강 기능 그리고 기호별로 총... 동그란사람https://blog.naver.com/birdweek?Redirect=Log&logNo=222688831748NOPI 비건네일 네이처스트롱 컬러 비건탑코트 발라봤어요2022-04-02이번에 만나보실 제품은 요즘 대세에 맞는 OPI 비건네일 네이처스트롱 컬러 랍니다. 우선, 비건이라는... 이번에 보여드리는 OPI 비건네일 네이처스트롱 컬러는 2022년 2월 7일 런칭되었어요. 기존에 했던 네일을... 올 어바웃 러브 : 뷰스타 호호미우 이벤트 중 ??https://blog.naver.com/hohomiu2?Redirect=Log&logNo=222689071829N양주 애견카페 애견운동장 네이처독 후기2022-03-27양주 애견동반맛집 노고산로뎀나무에서 바베큐를 먹고 다음이동코스로 애견운동장 네이처독에 왔다. 이왕 댕댕이 데리고 나왔으니 신나게 뛰뛰 하고 가야지! 자연테마 애견카페 컨셉인 네이처독... 찌니의 소꿉놀이세상 'ⓧ'https://blog.naver.com/jjin_njjin?Redirect=Log&logNo=222684247113N피부 나이 멈춰! 헤이네이처 어성초 세럼 후기2022-04-04헤이네이처 어성초 트리플 집중 세럼 용량 : 40ml / 가격 : 37,000원 안녕하세요 제이와이예요 :-) 어성초 맛집 헤이네이처 제품들 정말 많이 보여드렸죠 ~ 어성초라인의 토너와 피부타입별 앰플 모두 넘넘 잘... 제이와이 뷰티메뉴얼https://blog.naver.com/sunkjydbgn?Redirect=Log&logNo=222691100062",,,,,,,,,,,,,
